<?xml version="1.0" encoding="UTF-8"?>
<Customers xmlns="http://yarmolenka.it-academy.by/xml/Customers"
           xmlns:xsi="http://www.w3.org/2001/XMLSchema-instance"
           xsi:schemaLocation="http://yarmolenka.it-academy.by/xml/Customers 05.xsd">

    <Player>
        <Name>Alla Pugacheva</Name>
        <BirthDate>
            <Year>1939</Year>
            <Month>04</Month>
            <Day>15</Day>
        </BirthDate>
        <Phone>3822773</Phone>
        <Address>
            <Country>Russia</Country>
            <City>Moscow</City>
            <Street>Nikolskaya 27</Street>

        </Address>
        <Status>Platinum</Status>
        <Bar>Unlimited</Bar>
        <Cashback>0.2</Cashback>
    </Player>
    <Player>
        <Name>Maksim Galkin</Name>
        <BirthDate>
            <Year>1976</Year>
            <Month>06</Month>
            <Day>18</Day>
        </BirthDate>
        <Phone>3884773</Phone>
        <Address>
            <Country>Russia</Country>
            <City>Moscow</City>
            <Street>Dmitrovskaya 48</Street>
        </Address>
        <Status>Gold</Status>
        <Bar>Unlimited</Bar>
        <Cashback>0.1</Cashback>
    </Player>
</Customers>

